{
  "schemaVersion": 1,
  "behaviorMatrix": [
    {
      "id": "host-adapter-fixture",
      "behavior": "The focused host-adapter fixture reaches semantic dispatch.",
      "kind": "normal",
      "input": "a bounded fixture diff",
      "preconditions": "the test is scoped to host adapter behavior rather than candidate behavior",
      "expected": "no executable candidate evidence is applicable to this fixture",
      "risk": "low",
      "disposition": "not-applicable",
      "providerIds": [],
      "reason": "Host adapter telemetry and error normalization are exercised independently of the evidence sandbox."
    }
  ],
  "providers": [],
  "authorizations": []
}
